{
  "hash": "00000000000000000008281025b946b5f9b742009028b6ac998bed5432d68f56",
  "size": 1345325,
  "transaction_count": 2514,
  "version": 536870912,
  "previous_hash": "0000000000000000000e24a33da78e2d12b3af0436e770f2c4c139386e3fd114",
  "merkle_root": "44e30f55570eddccf25080cec165616036314069e2e9d1787697b9896e8a0ec4",
  "timestamp": 1587577020,
  "difficulty": {
    "nbits": 387031859
  },
  "nonce": 1883028948,
  "height": 627184,
  "subsidy": 1250000000,
  "input": 1065168755197,
  "output": 1065146209706,
  "transaction_fee": 22545491
}
